tweet_id,source,text,expanded_urls,rating_numerator,name,created_at,retweet_count,favorite_count,dog_stage,timestamp_delta,intercept
892420643555336193,iPhone,This is Phineas. He's a mystical boy. Only ever appears in the hole of a donut. 13/10 https://t.co/MgUWQ76dJU,https://twitter.com/dog_rates/status/892420643555336193/photo/1,13,Phineas,2017-08-01 16:23:56+00:00,7650,35960,,624.7443055555556,1
892177421306343426,iPhone,"This is Tilly. She's just checking pup on you. Hopes you're doing ok. If not, she's available for pats, snugs, boops, the whole bit. 13/10 https://t.co/0Xxu71qeIV",https://twitter.com/dog_rates/status/892177421306343426/photo/1,13,Tilly,2017-08-01 00:17:27+00:00,5650,31042,,624.073136574074,1
891815181378084864,iPhone,This is Archie. He is a rare Norwegian Pouncing Corgo. Lives in the tall grass. You never know when one may strike. 12/10 https://t.co/wUnZnhtVJB,https://twitter.com/dog_rates/status/891815181378084864/photo/1,12,Archie,2017-07-31 00:18:03+00:00,3748,23358,,623.0735532407407,1
891689557279858688,iPhone,This is Darla. She commenced a snooze mid meal. 13/10 happens to the best of us https://t.co/tD36da7qLQ,https://twitter.com/dog_rates/status/891689557279858688/photo/1,13,Darla,2017-07-30 15:58:51+00:00,7806,39248,,622.7268865740741,1
891327558926688256,iPhone,"This is Franklin. He would like you to stop calling him ""cute."" He is a very fierce shark and should be respected as such. 12/10 #BarkWeek https://t.co/AtUZn91f7f","https://twitter.com/dog_rates/status/891327558926688256/photo/1,https://twitter.com/dog_rates/status/891327558926688256/photo/1",12,Franklin,2017-07-29 16:00:24+00:00,8410,37504,,621.7279629629629,1
891087950875897856,iPhone,Here we have a majestic great white breaching off South Africa's coast. Absolutely h*ckin breathtaking. 13/10 (IG: tucker_marlo) #BarkWeek https://t.co/kQ04fDDRmh,https://twitter.com/dog_rates/status/891087950875897856/photo/1,13,,2017-07-29 00:08:17+00:00,2822,18899,,621.0667708333333,1
890971913173991426,iPhone,"Meet Jax. He enjoys ice cream so much he gets nervous around it. 13/10 help Jax enjoy more things by clicking below

https://t.co/Zr4hWfAs1H https://t.co/tVJBRMnhxl","https://gofundme.com/ydvmve-surgery-for-jax,https://twitter.com/dog_rates/status/890971913173991426/photo/1",13,Jax,2017-07-28 16:27:12+00:00,1839,10980,,620.746574074074,1
890729181411237888,iPhone,When you watch your owner call another dog a good boy but then they turn back to you and say you're a great boy. 13/10 https://t.co/v0nONBcwxq,"https://twitter.com/dog_rates/status/890729181411237888/photo/1,https://twitter.com/dog_rates/status/890729181411237888/photo/1",13,,2017-07-28 00:22:40+00:00,17065,60603,,620.0767592592592,1
890609185150312448,iPhone,This is Zoey. She doesn't want to be one of the scary sharks. Just wants to be a snuggly pettable boatpet. 13/10 #BarkWeek https://t.co/9TwLuAGH0b,https://twitter.com/dog_rates/status/890609185150312448/photo/1,13,Zoey,2017-07-27 16:25:51+00:00,3886,25994,,619.7456365740741,1
890240255349198849,iPhone,This is Cassie. She is a college pup. Studying international doggo communication and stick theory. 14/10 so elegant much sophisticate https://t.co/t1bfwz5S2A,https://twitter.com/dog_rates/status/890240255349198849/photo/1,14,Cassie,2017-07-26 15:59:51+00:00,6643,29715,doggo,618.7275810185185,1
890006608113172480,iPhone,This is Koda. He is a South Australian deckshark. Deceptively deadly. Frighteningly majestic. 13/10 would risk a petting #BarkWeek https://t.co/dVPW0B0Mme,"https://twitter.com/dog_rates/status/890006608113172480/photo/1,https://twitter.com/dog_rates/status/890006608113172480/photo/1",13,Koda,2017-07-26 00:31:25+00:00,6626,28591,,618.0828356481481,1
889880896479866881,iPhone,This is Bruno. He is a service shark. Only gets out of the water to assist you. 13/10 terrifyingly good boy https://t.co/u1XPQMl29g,https://twitter.com/dog_rates/status/889880896479866881/photo/1,13,Bruno,2017-07-25 16:11:53+00:00,4508,26009,,617.7359375,1
889665388333682689,iPhone,Here's a puppo that seems to be on the fence about something haha no but seriously someone help her. 13/10 https://t.co/BxvuXk0UCm,https://twitter.com/dog_rates/status/889665388333682689/photo/1,13,,2017-07-25 01:55:32+00:00,9039,44769,puppo,617.14125,1
889638837579907072,iPhone,This is Ted. He does his best. Sometimes that's not enough. But it's ok. 12/10 would assist https://t.co/f8dEDcrKSR,"https://twitter.com/dog_rates/status/889638837579907072/photo/1,https://twitter.com/dog_rates/status/889638837579907072/photo/1",12,Ted,2017-07-25 00:10:02+00:00,4053,25198,,617.0679861111112,1
889531135344209921,iPhone,This is Stuart. He's sporting his favorite fanny pack. Secretly filled with bones only. 13/10 puppared puppo #BarkWeek https://t.co/y70o6h3isq,https://twitter.com/dog_rates/status/889531135344209921/photo/1,13,Stuart,2017-07-24 17:02:04+00:00,2044,14128,puppo,616.770787037037,1
889278841981685760,iPhone,This is Oliver. You're witnessing one of his many brutal attacks. Seems to be playing with his victim. 13/10 fr*ckin frightening #BarkWeek https://t.co/WpHvrQedPb,https://twitter.com/dog_rates/status/889278841981685760/video/1,13,Oliver,2017-07-24 00:19:32+00:00,4826,23481,,616.0745833333333,1
888917238123831296,iPhone,This is Jim. He found a fren. Taught him how to sit like the good boys. 12/10 for both https://t.co/chxruIOUJN,https://twitter.com/dog_rates/status/888917238123831296/photo/1,12,Jim,2017-07-23 00:22:39+00:00,4064,27129,,615.0767476851852,1
888804989199671297,iPhone,This is Zeke. He has a new stick. Very proud of it. Would like you to throw it for him without taking it. 13/10 would do my best https://t.co/HTQ77yNQ5K,"https://twitter.com/dog_rates/status/888804989199671297/photo/1,https://twitter.com/dog_rates/status/888804989199671297/photo/1",13,Zeke,2017-07-22 16:56:37+00:00,3833,23826,,614.7670023148148,1
888554962724278272,iPhone,This is Ralphus. He's powering up. Attempting maximum borkdrive. 13/10 inspirational af https://t.co/YnYAFCTTiK,"https://twitter.com/dog_rates/status/888554962724278272/photo/1,https://twitter.com/dog_rates/status/888554962724278272/photo/1,https://twitter.com/dog_rates/status/888554962724278272/photo/1,https://twitter.com/dog_rates/status/888554962724278272/photo/1",13,Ralphus,2017-07-22 00:23:06+00:00,3147,18392,,614.0770601851851,1
888078434458587136,iPhone,This is Gerald. He was just told he didn't get the job he interviewed for. A h*ckin injustice. 12/10 didn't want the job anyway https://t.co/DK7iDPfuRX,"https://twitter.com/dog_rates/status/888078434458587136/photo/1,https://twitter.com/dog_rates/status/888078434458587136/photo/1",12,Gerald,2017-07-20 16:49:33+00:00,3139,20303,,612.7620949074075,1
887705289381826560,iPhone,This is Jeffrey. He has a monopoly on the pool noodles. Currently running a 'boop for two' midweek sale. 13/10 h*ckin strategic https://t.co/PhrUk20Q64,https://twitter.com/dog_rates/status/887705289381826560/photo/1,13,Jeffrey,2017-07-19 16:06:48+00:00,4887,28195,,611.7324074074074,1
887517139158093824,iPhone,I've yet to rate a Venezuelan Hover Wiener. This is such an honor. 14/10 paw-inspiring af (IG: roxy.thedoxy) https://t.co/20VrLAA8ba,https://twitter.com/dog_rates/status/887517139158093824/video/1,14,such,2017-07-19 03:39:09+00:00,10661,43240,,611.2132060185185,1
887473957103951883,iPhone,This is Canela. She attempted some fancy porch pics. They were unsuccessful. 13/10 someone help her https://t.co/cLyzpcUcMX,"https://twitter.com/dog_rates/status/887473957103951883/photo/1,https://twitter.com/dog_rates/status/887473957103951883/photo/1",13,Canela,2017-07-19 00:47:34+00:00,16286,64078,,611.0940509259259,1
887343217045368832,iPhone,You may not have known you needed to see this today. 13/10 please enjoy (IG: emmylouroo) https://t.co/WZqNqygEyV,https://twitter.com/dog_rates/status/887343217045368832/video/1,13,,2017-07-18 16:08:03+00:00,9482,31373,,610.733275462963,1
887101392804085760,iPhone,This... is a Jubilant Antarctic House Bear. We only rate dogs. Please only send dogs. Thank you... 12/10 would suffocate in floof https://t.co/4Ad1jzJSdp,https://twitter.com/dog_rates/status/887101392804085760/photo/1,12,,2017-07-18 00:07:08+00:00,5403,28560,,610.0659722222222,1
886983233522544640,iPhone,This is Maya. She's very shy. Rarely leaves her cup. 13/10 would find her an environment to thrive in https://t.co/I6oNy0CgiT,"https://twitter.com/dog_rates/status/886983233522544640/photo/1,https://twitter.com/dog_rates/status/886983233522544640/photo/1",13,Maya,2017-07-17 16:17:36+00:00,6936,32538,,609.7399074074074,1
886736880519319552,iPhone,"This is Mingus. He's a wonderful father to his smol pup. Confirmed 13/10, but he needs your help

https://t.co/bVi0Yr4Cff https://t.co/ISvKOSkd5b","https://www.gofundme.com/mingusneedsus,https://twitter.com/dog_rates/status/886736880519319552/photo/1,https://twitter.com/dog_rates/status/886736880519319552/photo/1",13,Mingus,2017-07-16 23:58:41+00:00,2910,11166,,609.0601041666666,1
886680336477933568,iPhone,This is Derek. He's late for a dog meeting. 13/10 pet...al to the metal https://t.co/BCoWue0abA,https://twitter.com/dog_rates/status/886680336477933568/photo/1,13,Derek,2017-07-16 20:14:00+00:00,4054,20956,,608.9040740740741,1
886366144734445568,iPhone,This is Roscoe. Another pupper fallen victim to spontaneous tongue ejections. Get the BlepiPen immediate. 12/10 deep breaths Roscoe https://t.co/RGE08MIJox,"https://twitter.com/dog_rates/status/886366144734445568/photo/1,https://twitter.com/dog_rates/status/886366144734445568/photo/1",12,Roscoe,2017-07-15 23:25:31+00:00,2870,19698,pupper,608.0370717592592,1
886267009285017600,iPhone,@NonWhiteHat @MayhewMayhem omg hello tanner you are a scary good boy 12/10 would pet with extreme caution,,12,,2017-07-15 16:51:35+00:00,4,111,,607.7635069444444,1
886258384151887873,iPhone,This is Waffles. His doggles are pupside down. Unsure how to fix. 13/10 someone assist Waffles https://t.co/xZDA9Qsq1O,https://twitter.com/dog_rates/status/886258384151887873/photo/1,13,Waffles,2017-07-15 16:17:19+00:00,5718,26094,,607.7397106481482,1
885984800019947520,iPhone,Viewer discretion advised. This is Jimbo. He will rip ur finger right h*ckin off. Other dog clearly an accessory. 12/10 pls pet with caution https://t.co/BuveP0uMF1,https://twitter.com/dog_rates/status/885984800019947520/photo/1,12,Jimbo,2017-07-14 22:10:11+00:00,6082,30382,,606.9847569444445,1
885528943205470208,iPhone,This is Maisey. She fell asleep mid-excavation. Happens to the best of us. 13/10 would pat noggin approvingly https://t.co/tp1kQ8i9JF,https://twitter.com/dog_rates/status/885528943205470208/photo/1,13,Maisey,2017-07-13 15:58:47+00:00,5784,33494,,605.7268402777778,1
885518971528720385,iPhone,I have a new hero and his name is Howard. 14/10 https://t.co/gzLHboL7Sk,https://twitter.com/4bonds2carbon/status/885517367337512960,14,,2017-07-13 15:19:09+00:00,3382,19091,,605.6993171296297,1
885167619883638784,iPhone,Here we have a corgi undercover as a malamute. Pawbably doing important investigative work. Zero control over tongue happenings. 13/10 https://t.co/44ItaMubBf,"https://twitter.com/dog_rates/status/885167619883638784/photo/1,https://twitter.com/dog_rates/status/885167619883638784/photo/1,https://twitter.com/dog_rates/status/885167619883638784/photo/1,https://twitter.com/dog_rates/status/885167619883638784/photo/1",13,,2017-07-12 16:03:00+00:00,3956,20401,,604.7297685185185,1
884925521741709313,iPhone,"This is Earl. He found a hat. Nervous about what you think of it. 12/10 it's delightful, Earl https://t.co/MYJvdlNRVa",https://twitter.com/dog_rates/status/884925521741709313/photo/1,12,Earl,2017-07-12 00:01:00+00:00,16367,71839,,604.0617129629629,1
884876753390489601,iPhone,This is Lola. It's her first time outside. Must test the earth and taste the atmosphere. 13/10 you're doing great Lola https://t.co/74TKAUsLkO,"https://twitter.com/dog_rates/status/884876753390489601/photo/1,https://twitter.com/dog_rates/status/884876753390489601/photo/1,https://twitter.com/dog_rates/status/884876753390489601/photo/1,https://twitter.com/dog_rates/status/884876753390489601/photo/1",13,Lola,2017-07-11 20:47:12+00:00,5048,25952,,603.9271296296296,1
884562892145688576,iPhone,This is Kevin. He's just so happy. 13/10 what is your secret Kevin https://t.co/1r4MFCbCX5,https://twitter.com/dog_rates/status/884562892145688576/photo/1,13,Kevin,2017-07-11 00:00:02+00:00,4254,22664,,603.0610416666667,1
884441805382717440,iPhone,"I present to you, Pup in Hat. Pup in Hat is great for all occasions. Extremely versatile. Compact as h*ck. 14/10 (IG: itselizabethgales) https://t.co/vvBOcC2VdC",https://twitter.com/dog_rates/status/884441805382717440/photo/1,14,,2017-07-10 15:58:53+00:00,5156,25275,,602.7269097222222,1
884247878851493888,iPhone,OMG HE DIDN'T MEAN TO HE WAS JUST TRYING A LITTLE BARKOUR HE'S SUPER SORRY 13/10 WOULD FORGIVE IMMEDIATE https://t.co/uF3pQ8Wubj,https://twitter.com/kaijohnson_19/status/883965650754039809,13,,2017-07-10 03:08:17+00:00,18389,67645,,602.1917708333333,1
884162670584377345,iPhone,Meet Yogi. He doesn't have any important dog meetings today he just enjoys looking his best at all times. 12/10 for dangerously dapper doggo https://t.co/YSI00BzTBZ,https://twitter.com/dog_rates/status/884162670584377345/photo/1,12,Yogi,2017-07-09 21:29:42+00:00,2712,19022,doggo,601.9566435185185,1
883838122936631299,iPhone,This is Noah. He can't believe someone made this mess. Got the vacuum out for you though. Offered to help clean pup. 12/10 super good boy https://t.co/V85xujjDDY,https://twitter.com/dog_rates/status/883838122936631299/photo/1,12,Noah,2017-07-09 00:00:04+00:00,3105,20374,,601.0610648148148,1
883482846933004288,iPhone,"This is Bella. She hopes her smile made you smile. If not, she is also offering you her favorite monkey. 13.5/10 https://t.co/qjrljjt948","https://twitter.com/dog_rates/status/883482846933004288/photo/1,https://twitter.com/dog_rates/status/883482846933004288/photo/1",5,Bella,2017-07-08 00:28:19+00:00,8947,42724,,600.0806828703704,1
883360690899218434,iPhone,Meet Grizzwald. He may be the floofiest floofer I ever did see. Lost eyes saving a schoolbus from a volcano erpuption. 13/10 heroic as h*ck https://t.co/rf661IFEYP,https://twitter.com/dog_rates/status/883360690899218434/photo/1,13,Grizzwald,2017-07-07 16:22:55+00:00,3351,21137,floofer,599.7435995370371,1
883117836046086144,iPhone,"Please only send dogs. We don't rate mechanics, no matter how h*ckin good. Thank you... 13/10 would sneak a pat https://t.co/Se5fZ9wp5E","https://twitter.com/dog_rates/status/883117836046086144/photo/1,https://twitter.com/dog_rates/status/883117836046086144/photo/1",13,,2017-07-07 00:17:54+00:00,6017,34604,,599.0734490740741,1
882992080364220416,iPhone,This is Rusty. He wasn't ready for the first pic. Clearly puppared for the second. 13/10 confirmed great boy https://t.co/tyER0KpdXj,"https://twitter.com/dog_rates/status/882992080364220416/photo/1,https://twitter.com/dog_rates/status/882992080364220416/photo/1",13,Rusty,2017-07-06 15:58:11+00:00,3520,22275,,598.7264236111112,1
882762694511734784,iPhone,This is Gus. He's quite the cheeky pupper. Already perfected the disinterested wink. 12/10 would let steal my girl https://t.co/D43I96SlVu,https://twitter.com/dog_rates/status/882762694511734784/photo/1,12,Gus,2017-07-06 00:46:41+00:00,4426,26330,pupper,598.0934375,1
882627270321602560,iPhone,This is Stanley. He has his first swim lesson today. Doggle straps adjusted. Ready to go. 13/10 Phelps is nervous (IG: stanleythe_corgi) https://t.co/Nx52PGwH94,https://twitter.com/dog_rates/status/882627270321602560/photo/1,13,Stanley,2017-07-05 15:48:34+00:00,5502,26098,,597.7197453703703,1
882268110199369728,iPhone,This is Alfy. You're witnessing his first watermelon experience. I think it was a success. 13/10 happy 4th Alfy ðŸ‡ºðŸ‡¸ https://t.co/fYP5RlutfA,"https://twitter.com/dog_rates/status/882268110199369728/photo/1,https://twitter.com/dog_rates/status/882268110199369728/photo/1,https://twitter.com/dog_rates/status/882268110199369728/photo/1",13,Alfy,2017-07-04 16:01:23+00:00,10482,41781,,596.7286458333333,1
882045870035918850,iPhone,"This is Koko. Her owner, inspired by Barney, recently built a cart for her to use during walks if she got tired. 13/10 rest easy Koko https://t.co/zeDpnsKX7w","https://twitter.com/dog_rates/status/882045870035918850/photo/1,https://twitter.com/dog_rates/status/882045870035918850/photo/1,https://twitter.com/dog_rates/status/882045870035918850/photo/1,https://twitter.com/dog_rates/status/882045870035918850/photo/1",13,Koko,2017-07-04 01:18:17+00:00,4420,27340,,596.1153819444445,1
881906580714921986,iPhone,This is Rey. He's a Benebop Cumberfloof. 12/10 dangerously pettable https://t.co/503CgWbhxQ,https://twitter.com/dog_rates/status/881906580714921986/photo/1,12,Rey,2017-07-03 16:04:48+00:00,3081,22702,,595.7310185185186,1
881666595344535552,iPhone,This is Gary. He couldn't miss this puppertunity for a selfie. Flawless focusing skills. 13/10 would boop intensely https://t.co/7CSWCl8I6s,https://twitter.com/dog_rates/status/881666595344535552/photo/1,13,Gary,2017-07-03 00:11:11+00:00,9662,47256,,595.0687847222222,1
881633300179243008,iPhone,@roushfenway These are good dogs but 17/10 is an emotional impulse rating. More like 13/10s,,17,,2017-07-02 21:58:53+00:00,7,117,,594.9769097222222,1
881536004380872706,iPhone,"Here is a pupper approaching maximum borkdrive. Zooming at never before seen speeds. 14/10 paw-inspiring af 
(IG: puffie_the_chow) https://t.co/ghXBIIeQZF",https://twitter.com/dog_rates/status/881536004380872706/video/1,14,a,2017-07-02 15:32:16+00:00,14476,46128,pupper,594.7084259259259,1
881268444196462592,iPhone,Meet Elliot. He's a Canadian Forrest Pup. Unusual number of antlers for a dog. Sneaky tongue slip to celebrate #Canada150. 12/10 would pet https://t.co/cgwJwowTMC,https://twitter.com/dog_rates/status/881268444196462592/photo/1,12,Elliot,2017-07-01 21:49:04+00:00,4783,21667,,593.9700925925926,1
880935762899988482,iPhone,This is Louis. He's crossing. It's a big deal. 13/10 h*ckin breathtaking https://t.co/D0wb1GlKAt,https://twitter.com/dog_rates/status/880935762899988482/photo/1,13,Louis,2017-06-30 23:47:07+00:00,2534,15954,,593.0520717592592,1
880872448815771648,iPhone,Ugh not again. We only rate dogs. Please don't send in well-dressed  floppy-tongued street penguins. Dogs only please. Thank you... 12/10 https://t.co/WiAMbTkDPf,https://twitter.com/dog_rates/status/880872448815771648/photo/1,12,,2017-06-30 19:35:32+00:00,3470,19851,,592.8773611111111,1
880465832366813184,iPhone,This is Bella. She had her first beach experience this morning. Complete success. 12/10 would perform a sandy boop https://t.co/4VsFysDmiw,"https://twitter.com/dog_rates/status/880465832366813184/photo/1,https://twitter.com/dog_rates/status/880465832366813184/photo/1,https://twitter.com/dog_rates/status/880465832366813184/photo/1,https://twitter.com/dog_rates/status/880465832366813184/photo/1",12,Bella,2017-06-29 16:39:47+00:00,5634,26544,,591.7553125,1
880221127280381952,iPhone,Meet Jesse. He's a Fetty Woof. His tongue ejects without warning. A true bleptomaniac. 12/10 would snug well https://t.co/fUod0tVmvK,"https://twitter.com/dog_rates/status/880221127280381952/photo/1,https://twitter.com/dog_rates/status/880221127280381952/photo/1",12,Jesse,2017-06-29 00:27:25+00:00,3780,25150,,591.0800578703704,1
880095782870896641,iPhone,Please don't send in photos without dogs in them. We're not @porch_rates. Insubordinate and churlish. Pretty good porch tho 11/10 https://t.co/HauE8M3Bu4,https://twitter.com/dog_rates/status/880095782870896641/photo/1,11,,2017-06-28 16:09:20+00:00,3932,25761,,590.7341666666666,1
879862464715927552,iPhone,This is Romeo. He would like to do an entrance. Requesting your immediate assistance. 13/10 https://t.co/Qh5aEkRQm9,"https://twitter.com/dog_rates/status/879862464715927552/photo/1,https://twitter.com/dog_rates/status/879862464715927552/photo/1,https://twitter.com/dog_rates/status/879862464715927552/photo/1",13,Romeo,2017-06-28 00:42:13+00:00,3167,20868,,590.0903356481482,1
879674319642796034,iPhone,@RealKentMurphy 14/10 confirmed,,14,,2017-06-27 12:14:36+00:00,10,293,,589.5711574074074,1
879492040517615616,iPhone,This is Bailey. He thinks you should measure ear length for signs of growth instead. 12/10 https://t.co/IxM9IMKQq8,https://twitter.com/dog_rates/status/879492040517615616/photo/1,12,Bailey,2017-06-27 00:10:17+00:00,2896,21911,,589.0681597222223,1
879415818425184262,iPhone,This is Duddles. He did an attempt. 13/10 someone help him (vid by Georgia Felici) https://t.co/UDT7ZkcTgY,https://twitter.com/dog_rates/status/879415818425184262/video/1,13,Duddles,2017-06-26 19:07:24+00:00,40311,98670,,588.8578240740741,1
879376492567855104,iPhone,This is Jack AKA Stephen Furry. You're not scoring on him. Unless he slips down the slide. 12/10 would happily get blocked by https://t.co/0gOi601EAa,https://twitter.com/dog_rates/status/879376492567855104/photo/1,12,Jack,2017-06-26 16:31:08+00:00,2837,15696,,588.7493055555556,1
879050749262655488,iPhone,This is Steven. He has trouble relating to other dogs. Quite shy. Neck longer than average. Tropical probably. 11/10 would still pet https://t.co/2mJCDEJWdD,https://twitter.com/dog_rates/status/879050749262655488/photo/1,11,Steven,2017-06-25 18:56:45+00:00,4266,21027,,587.8504282407407,1
879008229531029506,iPhone,This is Beau. That is Beau's balloon. He takes it everywhere. 13/10 would protect at all costs https://t.co/YDtpCjIPKN,https://twitter.com/dog_rates/status/879008229531029506/photo/1,13,Beau,2017-06-25 16:07:47+00:00,2429,17748,,587.7330902777778,1
878776093423087618,iPhone,This is Snoopy. He's a proud #PrideMonthPuppo. Impeccable handwriting for not having thumbs. 13/10 would love back #PrideMonth https://t.co/lNZwgNO4gS,"https://twitter.com/dog_rates/status/878776093423087618/photo/1,https://twitter.com/dog_rates/status/878776093423087618/photo/1",13,Snoopy,2017-06-25 00:45:22+00:00,3709,18092,puppo,587.0925231481482,1
878604707211726852,iPhone,Martha is stunning how h*ckin dare you. 13/10 https://t.co/9uABQXgjwa,https://twitter.com/bbcworld/status/878599868507402241,13,,2017-06-24 13:24:20+00:00,6431,28125,,586.6195833333334,1
878281511006478336,iPhone,"Meet Shadow. In an attempt to reach maximum zooming borkdrive, he tore his ACL. Still 13/10 tho. Help him out below

https://t.co/245xJJElsY https://t.co/lUiQH219v6","https://www.gofundme.com/3yd6y1c,https://twitter.com/dog_rates/status/878281511006478336/photo/1",13,Shadow,2017-06-23 16:00:04+00:00,1167,7216,,585.7277314814814,1
878057613040115712,iPhone,This is Emmy. She was adopted today. Massive round of pupplause for Emmy and her new family. 14/10 for all involved https://t.co/cwtWnHMVpe,"https://twitter.com/dog_rates/status/878057613040115712/photo/1,https://twitter.com/dog_rates/status/878057613040115712/photo/1",14,Emmy,2017-06-23 01:10:23+00:00,6171,39280,,585.1098958333333,1
877736472329191424,iPhone,This is Aja. She was just told she's a good dog. Suspicions confirmed. 13/10 would tell again https://t.co/lsPyyAiF1r,"https://twitter.com/dog_rates/status/877736472329191424/photo/1,https://twitter.com/dog_rates/status/877736472329191424/photo/1",13,Aja,2017-06-22 03:54:17+00:00,17219,74037,,584.2237152777777,1
877556246731214848,iPhone,This is Penny. She's both pupset and fired pup. Not pleased w your barbaric attempts at cleanliness. 12/10 would enjoy more shampoo options https://t.co/OYdDlfOGXP,https://twitter.com/dog_rates/status/877556246731214848/photo/1,12,Penny,2017-06-21 15:58:08+00:00,3456,21195,,583.7263888888889,1
877316821321428993,iPhone,"Meet Dante. At first he wasn't a fan of his new raincoat, then he saw his reflection. H*ckin handsome. 13/10 for water resistant good boy https://t.co/SHRTIo5pxc","https://twitter.com/dog_rates/status/877316821321428993/photo/1,https://twitter.com/dog_rates/status/877316821321428993/photo/1",13,Dante,2017-06-21 00:06:44+00:00,4734,25597,,583.0656944444445,1
877201837425926144,iPhone,This is Nelly. He graduated with his dogtorate today. Wants to know if you're proud of him. 12/10 would give congratulatory boop https://t.co/4g4cfj3P4Y,"https://twitter.com/dog_rates/status/877201837425926144/photo/1,https://twitter.com/dog_rates/status/877201837425926144/photo/1",12,Nelly,2017-06-20 16:29:50+00:00,5067,25321,,582.7484027777778,1
876838120628539392,iPhone,This is Ginger. She's having a ruff Monday. Too many pupper things going on. H*ckin exhausting. 12/10 would snug passionately https://t.co/j211oCDRs6,"https://twitter.com/dog_rates/status/876838120628539392/photo/1,https://twitter.com/dog_rates/status/876838120628539392/photo/1",12,Ginger,2017-06-19 16:24:33+00:00,3031,19338,pupper,581.7447337962963,1
876537666061221889,iPhone,I can say with the pupmost confidence that the doggos who assisted with this search are heroic as h*ck. 14/10 for all https://t.co/8yoc1CNTsu,https://twitter.com/mpstowerham/status/876162994446753793,14,,2017-06-18 20:30:39+00:00,4270,22135,,580.915636574074,1
876484053909872640,iPhone,This is Benedict. He wants to thank you for this delightful urban walk. Hopes you know he loves you. 13/10 super duper good boy https://t.co/26BXueUgbs,https://twitter.com/dog_rates/status/876484053909872640/photo/1,13,Benedict,2017-06-18 16:57:37+00:00,2155,17554,,580.7676967592593,1
876120275196170240,iPhone,"Meet Venti, a seemingly caffeinated puppoccino. She was just informed the weekend would include walks, pats and scritches. 13/10 much excite https://t.co/ejExJFq3ek",https://twitter.com/dog_rates/status/876120275196170240/photo/1,13,Venti,2017-06-17 16:52:05+00:00,4246,26160,,579.7638541666666,1
