tweet_id,source,text,expanded_urls,rating_numerator,name,created_at,retweet_count,favorite_count,dog_stage,timestamp_delta,intercept
801285448605831168,iPhone,oh h*ck 10/10 https://t.co/bC69RrW559,https://twitter.com/dog_rates/status/801285448605831168/photo/1,10,,2016-11-23 04:45:12+00:00,836,6137,,373.2590740740741,1
801167903437357056,iPhone,This is Milo. I would do terrible things for Milo. 13/10 https://t.co/R6wJyC2Tey,https://twitter.com/dog_rates/status/801167903437357056/photo/1,13,Milo,2016-11-22 20:58:07+00:00,6028,24796,,372.93471064814815,1
801115127852503040,iPhone,This is Bones. He's being haunted by another doggo of roughly the same size. 12/10 deep breaths pupper everything's fine https://t.co/55Dqe0SJNj,"https://twitter.com/dog_rates/status/801115127852503040/photo/1,https://twitter.com/dog_rates/status/801115127852503040/photo/1",12,Bones,2016-11-22 17:28:25+00:00,2133,8187,multiple,372.78908564814816,1
800859414831898624,iPhone,@SkyWilliams doggo simply protecting you from evil that which you cannot see. 11/10 would give extra pets,,11,,2016-11-22 00:32:18+00:00,98,695,doggo,372.08344907407405,1
800751577355128832,iPhone,Say hello to Mauve and Murphy. They're rather h*ckin filthy. Preferred nap over bath. Both 12/10 https://t.co/4UwCTW3lXG,"https://twitter.com/dog_rates/status/800751577355128832/photo/1,https://twitter.com/dog_rates/status/800751577355128832/photo/1,https://twitter.com/dog_rates/status/800751577355128832/photo/1",12,Mauve,2016-11-21 17:23:47+00:00,2839,10712,,371.78586805555557,1
800513324630806528,iPhone,This is Chef. Chef loves everyone and wants everyone to love each other. 11/10 https://t.co/ILHGs0e6Dm,https://twitter.com/dog_rates/status/800513324630806528/photo/1,11,Chef,2016-11-21 01:37:04+00:00,3035,13306,,371.1284259259259,1
800459316964663297,iPhone,Here's a very sleepy pupper. Appears to be portable as h*ck. 12/10 would snug intensely https://t.co/61sX7pW5Ca,https://twitter.com/dog_rates/status/800459316964663297/photo/1,12,,2016-11-20 22:02:27+00:00,2202,9642,pupper,370.97938657407406,1
800388270626521089,iPhone,This is Doc. He takes time out of every day to worship our plant overlords. 12/10 quite the floofer https://t.co/azMneS6Ly5,"https://twitter.com/dog_rates/status/800388270626521089/photo/1,https://twitter.com/dog_rates/status/800388270626521089/photo/1,https://twitter.com/dog_rates/status/800388270626521089/photo/1",12,Doc,2016-11-20 17:20:08+00:00,2852,11300,floofer,370.78333333333336,1
800141422401830912,iPhone,This is Peaches. She's the ultimate selfie sidekick. Super sneaky tongue slip appreciated. 13/10 https://t.co/pbKOesr8Tg,"https://twitter.com/dog_rates/status/800141422401830912/photo/1,https://twitter.com/dog_rates/status/800141422401830912/photo/1,https://twitter.com/dog_rates/status/800141422401830912/photo/1",13,Peaches,2016-11-20 00:59:15+00:00,2584,15496,,370.10216435185185,1
800018252395122689,iPhone,Here's a doggo doin a struggle. 11/10 much determined https://t.co/gQqRBfkX4I,https://twitter.com/dog_rates/status/800018252395122689/video/1,11,,2016-11-19 16:49:49+00:00,13375,28774,doggo,369.7622800925926,1
799757965289017345,iPhone,This is Sobe. She's a h*ckin happy doggo. Only one leg tho. Must have good balance. 13/10 would smile back https://t.co/OiH8PaOxB1,"https://twitter.com/dog_rates/status/799757965289017345/photo/1,https://twitter.com/dog_rates/status/799757965289017345/photo/1,https://twitter.com/dog_rates/status/799757965289017345/photo/1,https://twitter.com/dog_rates/status/799757965289017345/photo/1",13,Sobe,2016-11-18 23:35:32+00:00,2202,8519,doggo,369.0440277777778,1
799422933579902976,iPhone,This is Longfellow (prolly sophisticated). He's a North Appalachian Oatzenjammer. Concerned about wrinkled feets. 12/10 would hug softly https://t.co/bpLuQuxzHZ,https://twitter.com/dog_rates/status/799422933579902976/photo/1,12,Longfellow,2016-11-18 01:24:14+00:00,1957,8179,,368.1195138888889,1
799297110730567681,iPhone,This is Jeffrey. He's quite the jokester. Takes it too far sometimes. Still 11/10 would pet https://t.co/YDtZcAiMAf,"https://twitter.com/dog_rates/status/799297110730567681/photo/1,https://twitter.com/dog_rates/status/799297110730567681/photo/1",11,Jeffrey,2016-11-17 17:04:16+00:00,2804,10035,,367.7723148148148,1
799063482566066176,iPhone,This is Mister. He only wears the most fashionable af headwear. 11/10 h*ckin stylish https://t.co/BXJFKOVnJm,"https://twitter.com/dog_rates/status/799063482566066176/photo/1,https://twitter.com/dog_rates/status/799063482566066176/photo/1,https://twitter.com/dog_rates/status/799063482566066176/photo/1,https://twitter.com/dog_rates/status/799063482566066176/photo/1",11,Mister,2016-11-17 01:35:54+00:00,2505,8180,,367.12761574074074,1
798933969379225600,iPhone,This is Iroh. He's in a predicament. 12/10 someone help him https://t.co/KJAKO2kXsL,"https://twitter.com/dog_rates/status/798933969379225600/photo/1,https://twitter.com/dog_rates/status/798933969379225600/photo/1",12,Iroh,2016-11-16 17:01:16+00:00,4538,13275,,366.77023148148146,1
798925684722855936,iPhone,This is Shadow. He's a firm believer that they're all good dogs. H*ckin passionate about it too. 11/10 I stand with Shadow https://t.co/8yvpacwBcu,https://twitter.com/dog_rates/status/798925684722855936/photo/1,11,Shadow,2016-11-16 16:28:21+00:00,1467,7608,,366.7473726851852,1
798209839306514432,iPhone,This is Cooper. His bow tie was too heavy for the front so he moved it to the side. Balanced af now. 13/10 https://t.co/jG1PAFkB81,https://twitter.com/dog_rates/status/798209839306514432/photo/1,13,Cooper,2016-11-14 17:03:50+00:00,2607,10568,,364.77201388888886,1
797971864723324932,iPhone,Here's a helicopter pupper. He takes off at random. H*ckin hard to control. 12/10 rare af https://t.co/GRWPgNKt2z,"https://twitter.com/dog_rates/status/797971864723324932/photo/1,https://twitter.com/dog_rates/status/797971864723324932/photo/1",12,,2016-11-14 01:18:12+00:00,3162,11761,pupper,364.11532407407407,1
797545162159308800,iPhone,This is Cassie. She steals things. Guilt increases slightly each time. 12/10 would forgive almost immediately https://t.co/Ia19irLwyB,"https://twitter.com/dog_rates/status/797545162159308800/photo/1,https://twitter.com/dog_rates/status/797545162159308800/photo/1,https://twitter.com/dog_rates/status/797545162159308800/photo/1,https://twitter.com/dog_rates/status/797545162159308800/photo/1",12,Cassie,2016-11-12 21:02:38+00:00,4948,14748,,362.9378472222222,1
797236660651966464,iPhone,This is Pancake. She loves Batman and winks like a h*ckin champ. 12/10 real crowd pleaser https://t.co/6kqsAjJNhi,"https://twitter.com/dog_rates/status/797236660651966464/photo/1,https://twitter.com/dog_rates/status/797236660651966464/photo/1",12,Pancake,2016-11-12 00:36:46+00:00,6691,20244,,362.0865509259259,1
797165961484890113,iPhone,@JODYHiGHROLLER it may be an 11/10 but what do I know ðŸ˜‰,,11,,2016-11-11 19:55:50+00:00,26,227,,361.89145833333333,1
796865951799083009,iPhone,This is Tyr. He's just checking on you. Nifty af tongue slip. 12/10 would absolutely pet https://t.co/Jgnuiyvq06,https://twitter.com/dog_rates/status/796865951799083009/photo/1,12,Tyr,2016-11-11 00:03:42+00:00,1952,7803,,361.06358796296297,1
796759840936919040,iPhone,Say hello to Romeo. He was just told that it's too cold for the pool. H*ckin nonsense. 11/10 would help fill up https://t.co/6hx7ur6sNI,"https://twitter.com/dog_rates/status/796759840936919040/photo/1,https://twitter.com/dog_rates/status/796759840936919040/photo/1",11,Romeo,2016-11-10 17:02:03+00:00,3078,11999,,360.77077546296294,1
796484825502875648,iPhone,Here's a sleepy doggo that requested some assistance. 12/10 would carry everywhere https://t.co/bvkkqOjNDV,https://twitter.com/dog_rates/status/796484825502875648/photo/1,12,,2016-11-09 22:49:15+00:00,1787,7681,doggo,360.0118865740741,1
796387464403357696,iPhone,This is Snicku. He's having trouble reading because he's a dog. Glasses only helped a little. Nap preferred. 12/10 would snug well https://t.co/cVLUasbKA5,"https://twitter.com/dog_rates/status/796387464403357696/photo/1,https://twitter.com/dog_rates/status/796387464403357696/photo/1",12,Snicku,2016-11-09 16:22:22+00:00,4216,11152,,359.7432175925926,1
796149749086875649,iPhone,This is Ruby. She just turned on the news. Officially terrified. 11/10 deep breaths Ruby https://t.co/y5KarNXWXt,"https://twitter.com/dog_rates/status/796149749086875649/photo/1,https://twitter.com/dog_rates/status/796149749086875649/photo/1",11,Ruby,2016-11-09 00:37:46+00:00,14486,32692,,359.0872453703704,1
796125600683540480,iPhone,"#ImWithThor 13/10
https://t.co/a18mzkhTf6",https://twitter.com/king5seattle/status/796123679771897856,13,,2016-11-08 23:01:49+00:00,1836,5031,,359.02061342592594,1
796116448414461957,iPhone,I didn't believe it at first but now I can see that voter fraud is a serious h*ckin issue. 11/10 https://t.co/7i0bDMbrVN,https://twitter.com/dog_rates/status/796116448414461957/photo/1,11,,2016-11-08 22:25:27+00:00,2454,9225,,358.9953587962963,1
796080075804475393,iPhone,This is Yogi. He's 98% floof. Snuggable af. 12/10 https://t.co/opoXKxmfFm,https://twitter.com/dog_rates/status/796080075804475393/photo/1,12,Yogi,2016-11-08 20:00:55+00:00,2346,8583,,358.89498842592593,1
796031486298386433,iPhone,This is Daisy. She's here to make your day better. 13/10 mission h*ckin successful https://t.co/PbgvuD0qIL,https://twitter.com/dog_rates/status/796031486298386433/photo/1,13,Daisy,2016-11-08 16:47:50+00:00,3767,10955,,358.7609027777778,1
795464331001561088,iPhone,Elder doggo does a splash. Both 13/10 incredible stuff https://t.co/gBUDjdEcqz,https://twitter.com/dog_rates/status/795464331001561088/video/1,13,,2016-11-07 03:14:10+00:00,24006,50285,doggo,357.1958564814815,1
795400264262053889,iPhone,This is Brody. He's trying to make the same face as the football. 12/10 https://t.co/2H4MfOGlpQ,"https://twitter.com/dog_rates/status/795400264262053889/photo/1,https://twitter.com/dog_rates/status/795400264262053889/photo/1,https://twitter.com/dog_rates/status/795400264262053889/photo/1,https://twitter.com/dog_rates/status/795400264262053889/photo/1",12,Brody,2016-11-06 22:59:35+00:00,2922,10216,,357.0190625,1
795076730285391872,iPhone,This is Bailey. She loves going down slides but is very bad at it. Still 11/10 https://t.co/ivPWhspN3E,"https://twitter.com/dog_rates/status/795076730285391872/photo/1,https://twitter.com/dog_rates/status/795076730285391872/photo/1,https://twitter.com/dog_rates/status/795076730285391872/photo/1",11,Bailey,2016-11-06 01:33:58+00:00,5514,16424,,356.12627314814813,1
794926597468000259,iPhone,This is Mack. He's rather h*ckin sleepy. Exceptional ears. 12/10 would boop https://t.co/XRPvTPF0VH,https://twitter.com/dog_rates/status/794926597468000259/photo/1,12,Mack,2016-11-05 15:37:24+00:00,2338,10378,,355.71199074074076,1
794332329137291264,iPhone,This is Nimbus (like the cloud). He just bought this fancy af duck raincoat. Only protects one ear tho. 12/10 so h*ckin floofy https://t.co/SIQbb8c3AU,https://twitter.com/dog_rates/status/794332329137291264/photo/1,12,Nimbus,2016-11-04 00:15:59+00:00,2723,9715,,354.07211805555556,1
794205286408003585,iPhone,This is Laika. She was a space pupper. The first space pupper actually. Orbited earth like a h*ckin boss. 14/10 hero af https://t.co/trSjgY3h4g,"https://twitter.com/dog_rates/status/794205286408003585/photo/1,https://twitter.com/dog_rates/status/794205286408003585/photo/1,https://twitter.com/dog_rates/status/794205286408003585/photo/1",14,Laika,2016-11-03 15:51:10+00:00,3379,9354,pupper,353.72155092592595,1
793962221541933056,iPhone,This is Maximus. His face is stuck like that. Tragic really. Great tongue tho. 12/10 would pet firmly https://t.co/xIfrsMNLBR,"https://twitter.com/dog_rates/status/793962221541933056/photo/1,https://twitter.com/dog_rates/status/793962221541933056/photo/1",12,Maximus,2016-11-02 23:45:19+00:00,4962,17044,,353.05082175925924,1
793845145112371200,iPhone,This is Clark. He was just caught wearing pants. 13/10 game-changing af https://t.co/2Xo19aPrG5,https://twitter.com/dog_rates/status/793845145112371200/photo/1,13,Clark,2016-11-02 16:00:06+00:00,1899,9356,,352.72775462962966,1
793601777308463104,iPhone,This is Dobby. I can't stop looking at her feet. 12/10 would absolutely snug https://t.co/LhzPWv6rTv,https://twitter.com/dog_rates/status/793601777308463104/photo/1,12,Dobby,2016-11-01 23:53:02+00:00,1650,8098,,352.05618055555556,1
793500921481273345,iPhone,This is Fiona. She's an extremely mediocre copilot. Very distracting. Wink makes up for all the missed turns. 12/10 https://t.co/aF5MmpvPqN,"https://twitter.com/dog_rates/status/793500921481273345/photo/1,https://twitter.com/dog_rates/status/793500921481273345/photo/1",12,Fiona,2016-11-01 17:12:16+00:00,2414,10817,,351.77787037037035,1
793286476301799424,iPhone,This is Moreton. He's the Good Boy Who Lived. 13/10 magical as h*ck https://t.co/rLHGx3VAF3,"https://twitter.com/dog_rates/status/793286476301799424/photo/1,https://twitter.com/dog_rates/status/793286476301799424/photo/1",13,Moreton,2016-11-01 03:00:09+00:00,9307,24919,,351.1861226851852,1
793271401113350145,iPhone,Meet Dave. It's his favorite day of the year. He gets to fulfill his dream of being a dinosaur. 12/10 inspirational af https://t.co/MgQSdfZGPN,https://twitter.com/dog_rates/status/793271401113350145/photo/1,12,Dave,2016-11-01 02:00:14+00:00,2428,8824,,351.14451388888887,1
793256262322548741,iPhone,Oh h*ck look at this spookling right here. Fright level off the charts. 12/10 sufficiently spooked https://t.co/BNy9IIJMb0,https://twitter.com/dog_rates/status/793256262322548741/photo/1,12,,2016-11-01 01:00:05+00:00,8472,20248,,351.10274305555555,1
793241302385262592,iPhone,This is Tucker. He's out here bustin h*ckin ghosts. 13/10 dedicated af https://t.co/Ap477GhwXt,https://twitter.com/dog_rates/status/793241302385262592/photo/1,13,Tucker,2016-11-01 00:00:38+00:00,3352,10657,,351.06145833333335,1
793226087023144960,iPhone,"This is Juno. She spooked me up real good, but only to get my attention. Above average handwriting for a dog I think. 11/10 https://t.co/hFxxBCWlwj","https://twitter.com/dog_rates/status/793226087023144960/photo/1,https://twitter.com/dog_rates/status/793226087023144960/photo/1,https://twitter.com/dog_rates/status/793226087023144960/photo/1",11,Juno,2016-10-31 23:00:11+00:00,2916,9973,,351.01947916666666,1
793210959003287553,iPhone,This is Maude. She's the h*ckin happiest wasp you've ever seen. 10/10 would pet with caution https://t.co/etL8FHBrh8,https://twitter.com/dog_rates/status/793210959003287553/photo/1,10,Maude,2016-10-31 22:00:04+00:00,2840,9048,,350.9777314814815,1
793195938047070209,iPhone,Say hello to Lily. She's pupset that her costume doesn't fit as well as last year. 12/10 poor puppo https://t.co/YSi6K1firY,"https://twitter.com/dog_rates/status/793195938047070209/photo/1,https://twitter.com/dog_rates/status/793195938047070209/photo/1",12,Lily,2016-10-31 21:00:23+00:00,5718,15501,puppo,350.93628472222224,1
793180763617361921,iPhone,This is Newt. He's a strawberry. 11/10 https://t.co/2VhmlwxA1Q,https://twitter.com/dog_rates/status/793180763617361921/photo/1,11,Newt,2016-10-31 20:00:05+00:00,2031,7033,,350.89440972222224,1
793165685325201412,iPhone,This is Benji. He's Air Bud. It's a low effort costume but he pulls it off rather h*ckin well. 12/10 would happily get dunked on https://t.co/IbzT7DJvBo,https://twitter.com/dog_rates/status/793165685325201412/photo/1,12,Benji,2016-10-31 19:00:10+00:00,2832,9536,,350.8528009259259,1
793150605191548928,iPhone,This is Nida. She's a free elf. Waited so long for this day. 11/10 https://t.co/3lE8Izgmkf,https://twitter.com/dog_rates/status/793150605191548928/photo/1,11,Nida,2016-10-31 18:00:14+00:00,1726,6262,,350.81118055555555,1
793135492858580992,iPhone,Your favorite squad is looking extra h*ckin spooky today. 13/10 for all https://t.co/PrgvOyPtDT,"https://twitter.com/dog_rates/status/793135492858580992/photo/1,https://twitter.com/dog_rates/status/793135492858580992/photo/1",13,,2016-10-31 17:00:11+00:00,2538,6518,,350.76947916666666,1
793120401413079041,iPhone,"This is Robin. She's desperately trying to do me a frighten, but her tongue drastically decreases her spook value. Still 11/10 great effort https://t.co/sxMrsOZ8zb",https://twitter.com/dog_rates/status/793120401413079041/photo/1,11,Robin,2016-10-31 16:00:13+00:00,3980,12843,,350.72783564814813,1
792913359805018113,iPhone,Here is a perfect example of someone who has their priorities in order. 13/10 for both owner and Forrest https://t.co/LRyMrU7Wfq,"https://twitter.com/dog_rates/status/792913359805018113/photo/1,https://twitter.com/dog_rates/status/792913359805018113/photo/1,https://twitter.com/dog_rates/status/792913359805018113/photo/1,https://twitter.com/dog_rates/status/792913359805018113/photo/1",13,a,2016-10-31 02:17:31+00:00,4042,14535,,350.1565162037037,1
792883833364439040,iPhone,This is Bailey. She's rather h*ckin hype for Halloween tomorrow. Carved those pupkins herself. 12/10 https://t.co/v17mFm0Ftz,"https://twitter.com/dog_rates/status/792883833364439040/photo/1,https://twitter.com/dog_rates/status/792883833364439040/photo/1,https://twitter.com/dog_rates/status/792883833364439040/photo/1,https://twitter.com/dog_rates/status/792883833364439040/photo/1",12,Bailey,2016-10-31 00:20:11+00:00,4340,11463,,350.0750347222222,1
792773781206999040,iPhone,This is Monster. Not an actual monster tho. He's showing you his tongue. Very impressive Monster. 12/10 would snug https://t.co/RhaPExuxJL,https://twitter.com/dog_rates/status/792773781206999040/photo/1,12,Monster,2016-10-30 17:02:53+00:00,1703,7457,,349.77135416666664,1
792394556390137856,iPhone,Meet BeBe. She rocks the messy bun of your dreams. H*ckin flawless. 12/10 would watch her tutorial https://t.co/of0pFNBIl8,"https://twitter.com/dog_rates/status/792394556390137856/photo/1,https://twitter.com/dog_rates/status/792394556390137856/photo/1",12,BeBe,2016-10-29 15:55:58+00:00,4359,13634,,348.7248842592593,1
792050063153438720,iPhone,This is Remus. He's a mop that came to life. Can't see anything. Constantly trips over himself. Still a very good dog. 11/10 https://t.co/S3f1SYylzu,"https://twitter.com/dog_rates/status/792050063153438720/photo/1,https://twitter.com/dog_rates/status/792050063153438720/photo/1",11,Remus,2016-10-28 17:07:05+00:00,1829,7247,,347.77427083333333,1
791774931465953280,Vine,Vine will be deeply missed. This was by far my favorite one. 14/10 https://t.co/roqIxCvEB3,https://vine.co/v/ea0OwvPTx9l,14,,2016-10-27 22:53:48+00:00,22520,45724,,347.0150462962963,1
791672322847637504,iPhone,When she says you're a good boy and you know you're a good boy because you're a good boy. 13/10 https://t.co/O5IUmRHRIh,https://twitter.com/dog_rates/status/791672322847637504/photo/1,13,,2016-10-27 16:06:04+00:00,3185,11906,,346.73189814814816,1
791406955684368384,iPhone,Say hello to Levi. He's a Madagascan Butterbop. One of the more docile Butterbops I've seen. 12/10 would give all the pets https://t.co/Zcw9Sccctc,"https://twitter.com/dog_rates/status/791406955684368384/photo/1,https://twitter.com/dog_rates/status/791406955684368384/photo/1,https://twitter.com/dog_rates/status/791406955684368384/photo/1,https://twitter.com/dog_rates/status/791406955684368384/photo/1",12,Levi,2016-10-26 22:31:36+00:00,4179,13321,,345.9996296296296,1
791312159183634433,iPhone,This is Mabel. She's super h*ckin smol. Portable af. Comes with the smol shoe. 12/10 would keep in frocket https://t.co/GGJvxYt3xK,"https://twitter.com/dog_rates/status/791312159183634433/photo/1,https://twitter.com/dog_rates/status/791312159183634433/photo/1,https://twitter.com/dog_rates/status/791312159183634433/photo/1,https://twitter.com/dog_rates/status/791312159183634433/photo/1",12,Mabel,2016-10-26 16:14:55+00:00,2574,8914,,345.7380439814815,1
790987426131050500,iPhone,This is Misty. She has a cowboy hat on her nose. 12/10 https://t.co/Eno0mypHIr,https://twitter.com/dog_rates/status/790987426131050500/photo/1,12,Misty,2016-10-25 18:44:32+00:00,2168,9959,,344.84194444444444,1
790946055508652032,iPhone,This is Betty. She's assisting with the dishes. Such a good puppo. 12/10 h*ckin helpful af https://t.co/dgvTPZ9tgI,https://twitter.com/dog_rates/status/790946055508652032/photo/1,12,Betty,2016-10-25 16:00:09+00:00,4761,16876,puppo,344.72778935185187,1
790698755171364864,iPhone,This is Mosby. He appears to be rather h*ckin snuggable af. 12/10 keep it up Mosby https://t.co/IiiBq460I7,https://twitter.com/dog_rates/status/790698755171364864/photo/1,12,Mosby,2016-10-24 23:37:28+00:00,1955,8327,,344.0453703703704,1
790581949425475584,iPhone,This is Duke. He sneaks into the fridge sometimes. It's his safe place. 11/10 would give little jacket if necessary https://t.co/Fd5WFDTMH4,"https://twitter.com/dog_rates/status/790581949425475584/photo/1,https://twitter.com/dog_rates/status/790581949425475584/photo/1",11,Duke,2016-10-24 15:53:19+00:00,7262,20934,,343.72304398148145,1
790337589677002753,iPhone,Meet Maggie. She can hear your cells divide. 12/10 can also probably fly https://t.co/ovE2hqXryV,https://twitter.com/dog_rates/status/790337589677002753/photo/1,12,Maggie,2016-10-23 23:42:19+00:00,1911,7934,,343.04873842592593,1
790277117346975746,iPhone,This is Bruce. He never backs down from a challenge. 11/10 you got this Bruce https://t.co/aI7umZHIq7,https://twitter.com/dog_rates/status/790277117346975746/photo/1,11,Bruce,2016-10-23 19:42:02+00:00,3223,12737,,342.881875,1
789986466051088384,iPhone,This is Happy. He's a bathtub reviewer. Seems to be pleased with this one. 12/10 https://t.co/Ln89R4FP7v,https://twitter.com/dog_rates/status/789986466051088384/photo/1,12,Happy,2016-10-23 00:27:05+00:00,2346,9386,,342.0798263888889,1
789903600034189313,Vine,This is Ralphy. His dreams were just shattered. Poor pupper. 13/10 it'll be ok Ralphy https://t.co/P0kSN6rT6H,https://vine.co/v/5wPT1aBxPQZ,13,Ralphy,2016-10-22 18:57:48+00:00,4198,10493,pupper,341.8511574074074,1
789628658055020548,iPhone,This is Eli. He can fly. 13/10 magical af https://t.co/huPSJJ7FDI,https://twitter.com/dog_rates/status/789628658055020548/photo/1,13,Eli,2016-10-22 00:45:17+00:00,1793,7595,,341.09246527777776,1
789599242079838210,iPhone,This is Brownie. She's wearing a Halloween themed onesie. 12/10 festive af https://t.co/0R4meWXFOx,"https://twitter.com/dog_rates/status/789599242079838210/photo/1,https://twitter.com/dog_rates/status/789599242079838210/photo/1",12,Brownie,2016-10-21 22:48:24+00:00,1955,6863,,341.0112962962963,1
789530877013393408,iPhone,This is Rizzy. She smiles a lot. 12/10 contagious af https://t.co/TU4sZogVIq,"https://twitter.com/dog_rates/status/789530877013393408/photo/1,https://twitter.com/dog_rates/status/789530877013393408/photo/1,https://twitter.com/dog_rates/status/789530877013393408/photo/1",12,Rizzy,2016-10-21 18:16:44+00:00,3425,11879,,340.8226388888889,1
789314372632018944,iPhone,"HE WAS JUST A LIL SLEEPY FROM BEING SUCH A GOOD DOGGI ALL THE TIME MISTAKES HAPPEN 13/10
https://t.co/G2ms0A5jWM",https://twitter.com/sebscat/status/788818328538099712,13,,2016-10-21 03:56:25+00:00,2325,8767,,340.22519675925923,1
789268448748703744,iPhone,This is Stella. She's happier than I will ever be. 10/10 would trade lives with https://t.co/JSs2bfDtTS,https://twitter.com/dog_rates/status/789268448748703744/photo/1,10,Stella,2016-10-21 00:53:56+00:00,2641,9225,,340.0984722222222,1
789137962068021249,iPhone,This is Bo. He's a West Congolese Bugaboop Snuggle. Rather exotic. Master of the head tilt. 12/10 would pay to pet https://t.co/2jwxxtNzoN,"https://twitter.com/dog_rates/status/789137962068021249/photo/1,https://twitter.com/dog_rates/status/789137962068021249/photo/1,https://twitter.com/dog_rates/status/789137962068021249/photo/1",12,Bo,2016-10-20 16:15:26+00:00,2837,9845,,339.73840277777776,1
788908386943430656,iPhone,"This is Lucy. She destroyed not one, but two remotes trying to turn off the debate. 11/10 relatable af https://t.co/3BXh073tDm",https://twitter.com/dog_rates/status/788908386943430656/photo/1,11,Lucy,2016-10-20 01:03:11+00:00,12654,27792,,339.10489583333333,1
788765914992902144,iPhone,This is Butter. She can have whatever she wants forever. 12/10 would hug softly https://t.co/x5gXRS1abq,https://twitter.com/dog_rates/status/788765914992902144/photo/1,12,Butter,2016-10-19 15:37:03+00:00,10468,27684,,338.7117476851852,1
788412144018661376,iPhone,This is Dexter. He breaks hearts for a living. 11/10 h*ckin handsome af https://t.co/4DhSsC1W7S,"https://twitter.com/dog_rates/status/788412144018661376/photo/1,https://twitter.com/dog_rates/status/788412144018661376/photo/1",11,Dexter,2016-10-18 16:11:17+00:00,5343,15751,,337.73552083333334,1
788178268662984705,iPhone,Atlas is back and this time he's got doggles. Still 13/10 solarly conscious af https://t.co/s7MgFWDySc,"https://twitter.com/dog_rates/status/788178268662984705/photo/1,https://twitter.com/dog_rates/status/788178268662984705/photo/1,https://twitter.com/dog_rates/status/788178268662984705/photo/1,https://twitter.com/dog_rates/status/788178268662984705/photo/1",13,,2016-10-18 00:41:57+00:00,2124,7319,,337.090150462963,1
788150585577050112,iPhone,This is Leo. He's a golden chow. Rather h*ckin rare. 13/10 would give extra pats https://t.co/xosHjFzVXc,"https://twitter.com/dog_rates/status/788150585577050112/photo/1,https://twitter.com/dog_rates/status/788150585577050112/photo/1,https://twitter.com/dog_rates/status/788150585577050112/photo/1,https://twitter.com/dog_rates/status/788150585577050112/photo/1",13,Leo,2016-10-17 22:51:57+00:00,1305,6199,,337.01376157407407,1
