tweet_id,source,text,expanded_urls,rating_numerator,name,created_at,retweet_count,favorite_count,dog_stage,timestamp_delta,intercept
725786712245440512,iPhone,Say hello to Lillie. She's a Rutabagan Floofem. Poor pupper ate and then passed out. 11/10 relatable af https://t.co/uIdGqug9rw,https://twitter.com/dog_rates/status/725786712245440512/photo/1,11,Lillie,2016-04-28 20:40:11+00:00,1353,4110,pupper,164.92225694444446,1
725729321944506368,iPhone,This is Lola. She's a Butternut Splishnsplash. They are known to be ferocious af. 12/10 would absolutely still pet https://t.co/adQt5a6TZU,https://twitter.com/dog_rates/status/725729321944506368/photo/1,12,Lola,2016-04-28 16:52:08+00:00,1756,5129,,164.76388888888889,1
725458796924002305,iPhone,"Pup had to be removed cuz it wouldn't have been fair to the opposing team. 13/10 absolute legend âš½ï¸
https://t.co/BHICimO58W",https://twitter.com/foxdeportes/status/725136065078521856,13,,2016-04-27 22:57:10+00:00,608,1392,,164.01738425925927,1
724983749226668032,iPhone,This is Fred-Rick. He dabbles in parkour. The elevation gives him power. 12/10 hopefully visiting a mailbox near you https://t.co/qFqLtudIiD,https://twitter.com/dog_rates/status/724983749226668032/photo/1,12,Fred,2016-04-26 15:29:30+00:00,1290,3678,,162.70650462962962,1
724771698126512129,iPhone,Nothin better than a doggo and a sunset. 11/10 https://t.co/JlFqOhrHEs,"https://twitter.com/dog_rates/status/724771698126512129/photo/1,https://twitter.com/dog_rates/status/724771698126512129/photo/1,https://twitter.com/dog_rates/status/724771698126512129/photo/1,https://twitter.com/dog_rates/status/724771698126512129/photo/1",11,,2016-04-26 01:26:53+00:00,625,2315,doggo,162.12135416666666,1
724405726123311104,iPhone,This is Ashleigh. She's having Coachella withdrawals. Didn't even go tho. 10/10 stay strong pupper https://t.co/nRUaKWnJfH,https://twitter.com/dog_rates/status/724405726123311104/photo/1,10,Ashleigh,2016-04-25 01:12:38+00:00,1627,5204,pupper,161.11145833333333,1
724049859469295616,iPhone,This is Kreggory. He just took a look at his student debt. 10/10 can't even comprehend it https://t.co/XTsZTgilnT,https://twitter.com/dog_rates/status/724049859469295616/photo/1,10,Kreggory,2016-04-24 01:38:33+00:00,1750,4262,,160.1294560185185,1
724046343203856385,iPhone,"This is Sarge. Not even he knows what his tongue is doing, but it's pretty damn spectacular. 10/10 https://t.co/pIQEdbBxdL",https://twitter.com/dog_rates/status/724046343203856385/photo/1,10,Sarge,2016-04-24 01:24:35+00:00,546,2620,,160.11975694444445,1
724004602748780546,iPhone,This is Luther. He saw a ghost. Spooked af. 11/10 hang in there pupper https://t.co/EdKG43VvEl,"https://twitter.com/dog_rates/status/724004602748780546/photo/1,https://twitter.com/dog_rates/status/724004602748780546/photo/1,https://twitter.com/dog_rates/status/724004602748780546/photo/1",11,Luther,2016-04-23 22:38:43+00:00,1526,4112,pupper,160.00457175925925,1
723912936180330496,iPhone,This is Sugar. She's a Bolivian Superfloof. Spherical af. 12/10 would never let go of https://t.co/AhMfUu6Onm,https://twitter.com/dog_rates/status/723912936180330496/photo/1,12,Sugar,2016-04-23 16:34:28+00:00,1217,3831,,159.75162037037038,1
723688335806480385,iPhone,This is Reginald. He starts screaming at random. 12/10 cuddly af https://t.co/YgNuDQbv89,"https://twitter.com/dog_rates/status/723688335806480385/photo/1,https://twitter.com/dog_rates/status/723688335806480385/photo/1",12,Reginald,2016-04-23 01:41:59+00:00,2891,7567,,159.13184027777777,1
723673163800948736,iPhone,This is Ivar. She is a badass Viking warrior. Will sack your village. 10/10 savage af https://t.co/Dz6MiVssVU,https://twitter.com/dog_rates/status/723673163800948736/photo/1,10,Ivar,2016-04-23 00:41:42+00:00,873,2965,,159.08997685185184,1
723179728551723008,iPhone,This is Jangle. She's addicted to broccoli. It's the only thing she cares about. Tragic af. 8/10 get help pup https://t.co/8dNWp1cSEa,https://twitter.com/dog_rates/status/723179728551723008/photo/1,8,Jangle,2016-04-21 16:00:57+00:00,1834,5229,,157.7283449074074,1
722613351520608256,iPhone,Meet Schnitzel. He's a Tropicana Floofboop. Getting too big for his favorite basket. 12/10 just so damn fluffy https://t.co/qjd0UJKYUY,https://twitter.com/dog_rates/status/722613351520608256/photo/1,12,Schnitzel,2016-04-20 02:30:23+00:00,1614,4892,,156.1654513888889,1
721503162398597120,iPhone,This is Panda. He's happy af. 11/10 https://t.co/IOAk9i4UvE,"https://twitter.com/dog_rates/status/721503162398597120/photo/1,https://twitter.com/dog_rates/status/721503162398597120/photo/1,https://twitter.com/dog_rates/status/721503162398597120/photo/1,https://twitter.com/dog_rates/status/721503162398597120/photo/1",11,Panda,2016-04-17 00:58:53+00:00,1811,4554,,153.10190972222222,1
721001180231503872,iPhone,This is Oliver. Bath time is upon him. His fear of the wetness postpones his ultimate pupper destiny. 11/10 https://t.co/AFzzKqR4tT,https://twitter.com/dog_rates/status/721001180231503872/photo/1,11,Oliver,2016-04-15 15:44:11+00:00,601,2494,pupper,151.71670138888888,1
720785406564900865,iPhone,This is Archie. He hears everything you say. Doesn't matter where you are. 12/10 https://t.co/0l4I8famYp,https://twitter.com/dog_rates/status/720785406564900865/photo/1,12,Archie,2016-04-15 01:26:47+00:00,755,3073,,151.1212847222222,1
720775346191278080,iPhone,This is Berkeley. He's in a predicament. 10/10 someone help him https://t.co/XSEXdQupej,https://twitter.com/dog_rates/status/720775346191278080/photo/1,10,Berkeley,2016-04-15 00:46:48+00:00,654,2425,,151.09351851851852,1
720415127506415616,iPhone,Garden's coming in nice this year. 10/10 https://t.co/5Lra3e4rrw,"https://twitter.com/dog_rates/status/720415127506415616/photo/1,https://twitter.com/dog_rates/status/720415127506415616/photo/1,https://twitter.com/dog_rates/status/720415127506415616/photo/1",10,,2016-04-14 00:55:25+00:00,1478,4066,,150.09950231481483,1
720389942216527872,iPhone,This is RalphÃ©. He patrols the lake. Looking for babes. 11/10 https://t.co/Pb6iMmo0wk,https://twitter.com/dog_rates/status/720389942216527872/photo/1,11,RalphÃ©,2016-04-13 23:15:21+00:00,2465,6272,,150.03001157407408,1
720340705894408192,iPhone,This is Derek. He just got balled on. Can't even get up. Poor thing. 10/10 hang in there pupper https://t.co/BIRRF3bcWH,https://twitter.com/dog_rates/status/720340705894408192/photo/1,10,Derek,2016-04-13 19:59:42+00:00,964,2820,pupper,149.89414351851852,1
720059472081784833,iPhone,This is Charleson. He lost his plunger. Looked everywhere. Can't find it. So sad. 9/10 would comfort https://t.co/pRHX8yn9Yu,https://twitter.com/dog_rates/status/720059472081784833/photo/1,9,Charleson,2016-04-13 01:22:10+00:00,1108,3801,,149.1180787037037,1
720043174954147842,iPhone,This is Neptune. He's a Snowy Swiss Mountain Floofapolis. Cheeky wink. Tongue nifty af. 11/10 would pet so firmly https://t.co/SoZq2Xoopv,https://twitter.com/dog_rates/status/720043174954147842/photo/1,11,Neptune,2016-04-13 00:17:25+00:00,1974,4838,,149.07311342592592,1
719991154352222208,iPhone,This doggo was initially thrilled when she saw the happy cartoon pup but quickly realized she'd been deceived. 10/10 https://t.co/mvnBGaWULV,"https://twitter.com/dog_rates/status/719991154352222208/photo/1,https://twitter.com/dog_rates/status/719991154352222208/photo/1",10,,2016-04-12 20:50:42+00:00,1719,4771,doggo,148.92956018518518,1
719704490224398336,iPhone,This is Clyde. He's making sure you're having a good train ride. 12/10 great pupper https://t.co/y206kWHAj0,https://twitter.com/dog_rates/status/719704490224398336/photo/1,12,Clyde,2016-04-12 01:51:36+00:00,1406,4471,pupper,148.1385185185185,1
719551379208073216,iPhone,This is Harnold. He accidentally opened the front facing camera. 10/10 get it together Harnold https://t.co/S6JHaSMtln,https://twitter.com/dog_rates/status/719551379208073216/photo/1,10,Harnold,2016-04-11 15:43:12+00:00,1876,4967,,147.71601851851852,1
719367763014393856,iPhone,Meet Sid &amp; Murphy. Murphy floats alongside Sid and whispers motivational quotes in his ear. Magical af. Both 11/10 https://t.co/7mmjyearQW,https://twitter.com/dog_rates/status/719367763014393856/photo/1,11,Sid,2016-04-11 03:33:34+00:00,730,2757,,147.2093287037037,1
719339463458033665,iPhone,Say hello to Lucy and Sophie. They think they're the same size. Both 10/10 would snug at same time https://t.co/HW50zkcf2R,https://twitter.com/dog_rates/status/719339463458033665/photo/1,10,Lucy,2016-04-11 01:41:07+00:00,1211,4368,,147.13123842592591,1
719332531645071360,iPhone,This is Pippa. She managed to start the car but is waiting for you to buckle up before driving. Responsible af 11/10 https://t.co/htrlmC7saz,https://twitter.com/dog_rates/status/719332531645071360/photo/1,11,Pippa,2016-04-11 01:13:34+00:00,932,3380,,147.11210648148148,1
718971898235854848,iPhone,This is Sadie. She is prepared for battle. 10/10 https://t.co/JRckDkZVRT,https://twitter.com/dog_rates/status/718971898235854848/photo/1,10,Sadie,2016-04-10 01:20:33+00:00,1058,3431,,146.11695601851852,1
718939241951195136,iPhone,This is Otis. Everybody look at Otis. 12/10 would probably faint while petting https://t.co/I9qoe1uEih,https://twitter.com/dog_rates/status/718939241951195136/photo/1,12,Otis,2016-04-09 23:10:47+00:00,1731,5170,,146.02684027777778,1
718631497683582976,iPhone,We normally don't rate marshmallows but this one appears to be flawlessly toasted so I'll make an exception. 10/10 https://t.co/D9jbbmPmos,https://twitter.com/dog_rates/status/718631497683582976/photo/1,10,,2016-04-09 02:47:55+00:00,7917,18603,,145.17762731481483,1
718613305783398402,iPhone,This is Carper. He's a Tortellini Angiosperm. In desperate need of a petting. 11/10 would hug softly https://t.co/lK9YDkRzPj,https://twitter.com/dog_rates/status/718613305783398402/photo/1,11,Carper,2016-04-09 01:35:37+00:00,475,2402,,145.12741898148147,1
718540630683709445,iPhone,Get you a pup that can do both. 10/10 https://t.co/zSbyvm62xZ,"https://twitter.com/dog_rates/status/718540630683709445/photo/1,https://twitter.com/dog_rates/status/718540630683709445/photo/1",10,,2016-04-08 20:46:50+00:00,1000,2416,,144.926875,1
718460005985447936,iPhone,Meet Bowie. He's listening for underground squirrels. Smart af. Left eye is considerably magical. 9/10 would so pet https://t.co/JyNmyjy3fe,https://twitter.com/dog_rates/status/718460005985447936/photo/1,9,Bowie,2016-04-08 15:26:28+00:00,516,2652,,144.70439814814816,1
718454725339934721,iPhone,"This pic is old but I hadn't seen it until today and had to share. Creative af. 13/10 very good boy, would pet well https://t.co/4kD16wMA1Z",https://twitter.com/dog_rates/status/718454725339934721/photo/1,13,,2016-04-08 15:05:29+00:00,1490,4787,,144.6898263888889,1
718246886998687744,iPhone,This is Alexanderson. He's got a weird ass birth mark. Dreadful at fetch. Won't eat kibble. 3/10 wtf @Target https://t.co/FmxOpf2Sgl,https://twitter.com/dog_rates/status/718246886998687744/photo/1,3,Alexanderson,2016-04-08 01:19:36+00:00,493,1879,,144.1162962962963,1
718234618122661888,iPhone,This is Suki. She was born with a blurry tail (unfortunate). Next level tongue tho. 11/10 nifty hardwood https://t.co/05S8oYztgb,https://twitter.com/dog_rates/status/718234618122661888/photo/1,11,Suki,2016-04-08 00:30:51+00:00,978,3808,,144.08244212962964,1
717841801130979328,iPhone,This is Barclay. His father was a banana. 11/10 appeeling af https://t.co/ucOEfr2rjV,https://twitter.com/dog_rates/status/717841801130979328/photo/1,11,Barclay,2016-04-06 22:29:56+00:00,596,2418,,142.99847222222223,1
717790033953034240,iPhone,"Here's a badass mystery pupper. You weren't aware that you owe him money, but you do. 10/10 shades sick af https://t.co/fv9e9AtzSG",https://twitter.com/dog_rates/status/717790033953034240/photo/1,10,,2016-04-06 19:04:14+00:00,1092,2837,pupper,142.855625,1
717537687239008257,iPhone,People please. This is a Deadly Mediterranean Plop T-Rex. We only rate dogs. Only send in dogs. Thanks you... 11/10 https://t.co/2ATDsgHD4n,https://twitter.com/dog_rates/status/717537687239008257/photo/1,11,a,2016-04-06 02:21:30+00:00,1826,5701,,142.1592824074074,1
717428917016076293,Vine,This is Skittle. He's trying to communicate. 11/10 solid effort https://t.co/6WTfJvtKx6,https://vine.co/v/iIhEU2lVqxz,11,Skittle,2016-04-05 19:09:17+00:00,441,1592,,141.85913194444444,1
717421804990701568,iPhone,This is Ebby. She's a Zimbabwean Feta. Embarrassed by ridiculously squishy face. 9/10 would squeeze softly https://t.co/LBJqxMGaHi,"https://twitter.com/dog_rates/status/717421804990701568/photo/1,https://twitter.com/dog_rates/status/717421804990701568/photo/1",9,Ebby,2016-04-05 18:41:02+00:00,828,3116,,141.8395138888889,1
717047459982213120,iPhone,This is FlÃ¡vio (pronounced Baxter). He's a Benesnoop Cumberdog. Super rare. Symmetrical. 12/10 would pet so well https://t.co/fGgleFiBPq,https://twitter.com/dog_rates/status/717047459982213120/photo/1,12,FlÃ¡vio,2016-04-04 17:53:31+00:00,1900,6200,,140.8065162037037,1
717009362452090881,iPhone,This is Smokey. He's having some sort of existential crisis. 10/10 hang in there pupper https://t.co/JmgF4dMpw0,https://twitter.com/dog_rates/status/717009362452090881/photo/1,10,Smokey,2016-04-04 15:22:08+00:00,947,3199,pupper,140.70138888888889,1
716802964044845056,iPhone,This is Link. He struggles with couches. 10/10 would assist https://t.co/SbX4e6Yg3o,"https://twitter.com/dog_rates/status/716802964044845056/photo/1,https://twitter.com/dog_rates/status/716802964044845056/photo/1",10,Link,2016-04-04 01:41:58+00:00,1153,4224,,140.1318287037037,1
716791146589110272,iPhone,Meet Jennifur. She's supposed to be navigating. Not even buckled up. Insubordinate &amp; churlish. 11/10 would still pet https://t.co/h0trcJohYO,https://twitter.com/dog_rates/status/716791146589110272/photo/1,11,Jennifur,2016-04-04 00:55:01+00:00,1554,8041,,140.09922453703703,1
716730379797970944,iPhone,"There has clearly been a mistake. Pup did nothing wrong. 12/10 would help escape
https://t.co/Juid3nnLbC",https://twitter.com/chpsanfrancisco/status/716637124322177024,12,,2016-04-03 20:53:33+00:00,420,1214,,139.93153935185185,1
716447146686459905,Vine,This is Ozzy. He's acrobatic af. Legendary pupper status achieved. 13/10 https://t.co/gHWsCTu90E,https://vine.co/v/eMmXVPn5eQK,13,Ozzy,2016-04-03 02:08:05+00:00,5780,12877,pupper,139.14996527777777,1
716285507865542656,iPhone,This is Stephanus. She stays woke. 12/10 https://t.co/WIWabMngQZ,"https://twitter.com/dog_rates/status/716285507865542656/photo/1,https://twitter.com/dog_rates/status/716285507865542656/photo/1",12,Stephanus,2016-04-02 15:25:47+00:00,1039,2728,,138.70392361111112,1
716080869887381504,iPhone,Here's a super majestic doggo and a sunset 11/10 https://t.co/UACnoyi8zu,"https://twitter.com/dog_rates/status/716080869887381504/photo/1,https://twitter.com/dog_rates/status/716080869887381504/photo/1",11,,2016-04-02 01:52:38+00:00,1869,6663,doggo,138.1392361111111,1
715928423106027520,iPhone,This is Bubbles. He's a Yorkshire Piccolope. 11/10 would snug aggressively https://t.co/3BhMojONxq,https://twitter.com/dog_rates/status/715928423106027520/photo/1,11,Bubbles,2016-04-01 15:46:52+00:00,864,3143,,137.7185648148148,1
715758151270801409,Vine,This is old now but it's absolutely heckin fantastic and I can't not share it with you all. 13/10  https://t.co/wJX74TSgzP,https://vine.co/v/hYdLVKDpAFu,13,old,2016-04-01 04:30:16+00:00,1412,3664,,137.2487037037037,1
715733265223708672,iPhone,This is a taco. We only rate dogs. Please only send in dogs. Dogs are what we rate. Not tacos. Thank you... 10/10 https://t.co/cxl6xGY8B9,https://twitter.com/dog_rates/status/715733265223708672/photo/1,10,a,2016-04-01 02:51:22+00:00,1663,4586,,137.18002314814814,1
715704790270025728,Vine,This is Bentley. He gives kisses back. 11/10 precious af (vid by @emmaallen25) https://t.co/9PnKkKzoUp,https://vine.co/v/ijAlDnuOD0l,11,Bentley,2016-04-01 00:58:13+00:00,558,2750,,137.10144675925926,1
715696743237730304,iPhone,Meet Toby. He's a Lithuanian High-Steppin Stickeroo. One of the more accomplished Stickeroos around. 10/10 so nifty https://t.co/cYPHuJYTjC,https://twitter.com/dog_rates/status/715696743237730304/photo/1,10,Toby,2016-04-01 00:26:15+00:00,1270,3852,,137.07924768518518,1
715680795826982913,iPhone,This is Zeus. He's downright fabulous. 12/10 https://t.co/sSugyyRuTp,"https://twitter.com/dog_rates/status/715680795826982913/photo/1,https://twitter.com/dog_rates/status/715680795826982913/photo/1,https://twitter.com/dog_rates/status/715680795826982913/photo/1",12,Zeus,2016-03-31 23:22:53+00:00,1591,4242,,137.03524305555555,1
715360349751484417,iPhone,This is Bertson. He just wants to say hi. 11/10 would boop nose https://t.co/hwv7Wq6gDA,https://twitter.com/dog_rates/status/715360349751484417/photo/1,11,Bertson,2016-03-31 02:09:32+00:00,1538,5392,,136.1509722222222,1
715342466308784130,iPhone,This is Oscar. He's a world renowned snowball inspector. It's a ruff job but someone has to do it. 10/10 great guy https://t.co/vSufMAKm3C,"https://twitter.com/dog_rates/status/715342466308784130/photo/1,https://twitter.com/dog_rates/status/715342466308784130/photo/1",10,Oscar,2016-03-31 00:58:29+00:00,686,2996,,136.10163194444445,1
715220193576927233,iPhone,This is Nico. His selfie game is strong af. Excellent use of a sneaky tongue slip. 10/10 star material https://t.co/1OBdJkMOFx,https://twitter.com/dog_rates/status/715220193576927233/photo/1,10,Nico,2016-03-30 16:52:36+00:00,639,2387,,135.76421296296297,1
715200624753819648,iPhone,This is Michelangelope. He's half coffee cup. Rare af. 12/10 would hug until someone stopped me https://t.co/tvVDY0G911,https://twitter.com/dog_rates/status/715200624753819648/photo/1,12,Michelangelope,2016-03-30 15:34:51+00:00,1854,5065,,135.7102199074074,1
715009755312439296,iPhone,This is Siba. She's remarkably mobile. Very sleepy as well. 12/10 would happily transport https://t.co/TjnI33RE1i,https://twitter.com/dog_rates/status/715009755312439296/photo/1,12,Siba,2016-03-30 02:56:24+00:00,1210,4092,,135.18351851851853,1
714982300363173890,iPhone,This is Calbert. He forgot to clear his Google search history. 9/10 rookie mistake Calbert https://t.co/jRm5J3YCmj,https://twitter.com/dog_rates/status/714982300363173890/photo/1,9,Calbert,2016-03-30 01:07:18+00:00,1017,3682,,135.10775462962962,1
714962719905021952,Vine,Just in case anyone's having a bad day. 12/10 would bounce with https://t.co/T9sgP9ttnQ,https://vine.co/v/inVtemLt9tE,12,,2016-03-29 23:49:30+00:00,4195,7245,,135.05372685185185,1
714957620017307648,iPhone,This is Curtis. He's an Albino Haberdasher. Terrified of dandelions. They really spook him up. 10/10 it'll be ok pup https://t.co/s8YcfZrWhK,https://twitter.com/dog_rates/status/714957620017307648/photo/1,10,Curtis,2016-03-29 23:29:14+00:00,1392,4070,,135.03965277777777,1
714631576617938945,iPhone,This is Benedict. He's a feisty pup. Needs a brushing. Portable af. Looks very angry actually. 4/10 might not pet https://t.co/3oeFfHjv0Z,https://twitter.com/dog_rates/status/714631576617938945/photo/1,4,Benedict,2016-03-29 01:53:39+00:00,981,3227,,134.13994212962962,1
714606013974974464,iPhone,Here are two lil cuddly puppers. Both 12/10 would snug like so much https://t.co/zO4eb7C4tG,https://twitter.com/dog_rates/status/714606013974974464/photo/1,12,,2016-03-29 00:12:05+00:00,912,3580,,134.06940972222222,1
714485234495041536,Vine,This is Blitz. He screams. 10/10 (vid by @yeaahliv) https://t.co/MfW2aym5UF,https://vine.co/v/iDrOvVqq0A6,10,Blitz,2016-03-28 16:12:09+00:00,1110,2648,,133.7361226851852,1
714258258790387713,iPhone,"Meet Travis and Flurp. Travis is pretty chill but Flurp can't lie down properly. 10/10 &amp; 8/10
get it together Flurp https://t.co/Akzl5ynMmE",https://twitter.com/dog_rates/status/714258258790387713/photo/1,10,Travis,2016-03-28 01:10:13+00:00,713,2986,,133.1097800925926,1
714251586676113411,iPhone,This is Thumas. He hates potted plants. 8/10 wtf Thumas https://t.co/rDVueNIcEi,"https://twitter.com/dog_rates/status/714251586676113411/photo/1,https://twitter.com/dog_rates/status/714251586676113411/photo/1",8,Thumas,2016-03-28 00:43:43+00:00,823,3229,,133.09137731481482,1
714214115368108032,iPhone,Happy Easter from the squad! ðŸ‡ðŸ¶ 13/10 for all https://t.co/YMx4KWJUAB,https://twitter.com/dog_rates/status/714214115368108032/photo/1,13,,2016-03-27 22:14:49+00:00,856,2233,,132.98797453703705,1
714141408463036416,iPhone,"I know we only rate dogs, but since it's Easter I guess we could rate a bunny for a change. 10/10 petable as hell https://t.co/O2RlKXigHu",https://twitter.com/dog_rates/status/714141408463036416/photo/1,10,,2016-03-27 17:25:54+00:00,1376,4264,,132.78733796296297,1
713919462244790272,iPhone,This is Kanu. He's a Freckled Ticonderoga. Simply flawless. 12/10 would perform an elaborate heist to capture https://t.co/7vyAzIURrE,https://twitter.com/dog_rates/status/713919462244790272/photo/1,12,Kanu,2016-03-27 02:43:58+00:00,780,3246,,132.17488425925927,1
713909862279876608,Vine,This is Doug. His nose is legendary af. 12/10 (vid by @probably_trey) https://t.co/7IWKfbfihS,https://vine.co/v/iDWlapaXWmm,12,Doug,2016-03-27 02:05:49+00:00,530,1866,,132.1483912037037,1
713761197720473600,iPhone,This is Piper. She would really like that tennis ball core. Super sneaky tongue slip. 12/10 precious af https://t.co/QP6GHi5az9,"https://twitter.com/dog_rates/status/713761197720473600/photo/1,https://twitter.com/dog_rates/status/713761197720473600/photo/1",12,Piper,2016-03-26 16:15:05+00:00,1352,4791,,131.73815972222224,1
713411074226274305,iPhone,Here we see an extremely rare Bearded Floofmallow. Only a few left in the wild. 11/10 would pet with a purpose https://t.co/jVJJKlPbvq,https://twitter.com/dog_rates/status/713411074226274305/photo/1,11,,2016-03-25 17:03:49+00:00,1282,4382,,130.7720023148148,1
713177543487135744,iPhone,This is Lance. Lance doesn't give a shit. 10/10 we should all be more like Lance https://t.co/SqnG9Ap28J,https://twitter.com/dog_rates/status/713177543487135744/photo/1,10,Lance,2016-03-25 01:35:51+00:00,2792,7122,,130.12758101851853,1
713175907180089344,iPhone,Say hello to Opie and Clarkus. Clarkus fell asleep so Opie buried him. Ruthless af 10/10 for both https://t.co/xT7XaY4gnW,https://twitter.com/dog_rates/status/713175907180089344/photo/1,10,Opie,2016-03-25 01:29:21+00:00,1454,4396,,130.12306712962962,1
712809025985978368,iPhone,This is Stubert. He just arrived. 10/10 https://t.co/HVGs5aAKAn,https://twitter.com/dog_rates/status/712809025985978368/photo/1,10,Stubert,2016-03-24 01:11:29+00:00,6632,18807,,129.1106597222222,1
712717840512598017,iPhone,Please don't send in any more polar bears. We only rate dogs. Thank you... 10/10 https://t.co/83RGhdIQz2,https://twitter.com/dog_rates/status/712717840512598017/photo/1,10,,2016-03-23 19:09:09+00:00,4905,12174,,128.85903935185186,1
712668654853337088,iPhone,Say hello to Sunny and Roxy. They pull things out of water together. 10/10 for both https://t.co/88aedAmxcl,"https://twitter.com/dog_rates/status/712668654853337088/photo/1,https://twitter.com/dog_rates/status/712668654853337088/photo/1,https://twitter.com/dog_rates/status/712668654853337088/photo/1",10,Sunny,2016-03-23 15:53:42+00:00,1197,4124,,128.7233101851852,1
712438159032893441,iPhone,This is Kane. He's a semi-submerged Haitian Huffleplop. Happy af. Sick waterfall. 11/10 would pat head approvingly https://t.co/7zjEC501Ul,https://twitter.com/dog_rates/status/712438159032893441/photo/1,11,Kane,2016-03-23 00:37:48+00:00,1541,5243,,128.08726851851853,1
712309440758808576,iPhone,"Reminder that we made our first set of stickers available! All are 12/10 would stick
Use code ""pupper"" at checkoutðŸ¶

https://t.co/kJIMNyMNKV",https://twitter.com/stickergrub/status/709919141004595201,12,,2016-03-22 16:06:19+00:00,25,241,pupper,127.73207175925926,1
712097430750289920,iPhone,I can't even comprehend how confused this dog must be right now. 10/10 https://t.co/8AGcQ4hIfK,https://twitter.com/dog_rates/status/712097430750289920/photo/1,10,,2016-03-22 02:03:52+00:00,1016,3725,,127.14703703703704,1
712092745624633345,iPhone,This is Steven. He's inverted af. Also very helpful. Scans anything you want for free. Takes him a while tho. 7/10 https://t.co/tA0ZiQ7JcG,https://twitter.com/dog_rates/status/712092745624633345/photo/1,7,Steven,2016-03-22 01:45:15+00:00,874,2902,,127.1341087962963,1
712085617388212225,iPhone,"Say hello to Olive and Ruby. They are best buddies. Both 11/10 
1 like = 1 buddy https://t.co/yagmFdKlyL","https://twitter.com/dog_rates/status/712085617388212225/photo/1,https://twitter.com/dog_rates/status/712085617388212225/photo/1,https://twitter.com/dog_rates/status/712085617388212225/photo/1",11,Olive,2016-03-22 01:16:55+00:00,479,3228,,127.11443287037036,1
712065007010385924,iPhone,This is Chester. He's clearly in charge of the other dogs. Weird ass paws. Not fit for fetch. 6/10 would still pet https://t.co/o2GvskrhHt,https://twitter.com/dog_rates/status/712065007010385924/photo/1,6,Chester,2016-03-21 23:55:01+00:00,612,2236,,127.05755787037037,1
711968124745228288,iPhone,Meet Winston. He's trapped in a cup of coffee. Poor pupper. 10/10 someone free him https://t.co/2e6cUtKUuc,https://twitter.com/dog_rates/status/711968124745228288/photo/1,10,Winston,2016-03-21 17:30:03+00:00,2268,7951,pupper,126.7902199074074,1
711743778164514816,iPhone,Meet Roosevelt. He's calculating the best case scenario if he drops out instead of doing math hw. 11/10 relatable af https://t.co/QcSIRDpfVg,https://twitter.com/dog_rates/status/711743778164514816/photo/1,11,Roosevelt,2016-03-21 02:38:34+00:00,973,2801,,126.17113425925926,1
